{
  "_note": "Front door structure ONLY — week ordering, library columns, safety-kit membership, per-site roles, search synonyms. Facts about an item (minutes, summary, key points, attestation) live in topic_meta.json and join at render time; never duplicate them here. Validated by 13_Faculty_Resources/_automation/validate_curriculum.py.",
  "learningPaths": {
    "ms3": {
      "id": "ms3-six-week",
      "weeks": [
        {
          "n": 1,
          "title": "Foundations & the MSE",
          "theme": "Orientation · interviewing · MSE",
          "landingRef": "week1.md",
          "focusCategories": ["safety"],
          "items": [
        { "ref": "welcome.md", "kind": "read" },
        { "ref": "pg_interview.md", "kind": "read" },
        { "ref": "pg_suicide.md", "kind": "read" },
        { "ref": "agitation.md", "kind": "read" },
        { "ref": "delirium.md", "kind": "read" },
        { "ref": "withdrawal.html", "kind": "tool" },
        { "ref": "doc_oral.md", "kind": "read" },
        { "ref": "mse.html", "kind": "tool" },
        { "ref": "sp-interview.html", "kind": "tool" },
        { "ref": "one-patient-six-weeks.html", "kind": "tool" },
        { "ref": "question-bank-practice.html", "kind": "tool" }
          ]
        },
        {
          "n": 2,
          "title": "Mood, Psychosis & Pharm",
          "theme": "Dx frameworks · the top-10 drugs",
          "landingRef": "week2.md",
          "focusCategories": ["mood", "psychosis", "pharm", "neurocog"],
          "items": [
        { "ref": "t_mood.md", "kind": "read" },
        { "ref": "t_psychosis.md", "kind": "read" },
        { "ref": "psychopharm_primer.md", "kind": "read" },
        { "ref": "ddx.md", "kind": "read" },
        { "ref": "sp-interview.html", "kind": "tool" },
        { "ref": "diagnostic-reasoning.html", "kind": "tool" },
        { "ref": "one-patient-six-weeks.html", "kind": "tool" },
        { "ref": "question-bank-practice.html", "kind": "tool" }
          ]
        },
        {
          "n": 3,
          "title": "Psychotherapy & Personality",
          "theme": "Alliance · brief therapy · PDs",
          "landingRef": "week3.md",
          "focusCategories": ["personality", "anxiety", "relational"],
          "items": [
        { "ref": "t_personality.md", "kind": "read" },
        { "ref": "exp_tx.md", "kind": "read" },
        { "ref": "brief_psychotherapy.md", "kind": "read" },
        { "ref": "reflection.html", "kind": "tool" },
        { "ref": "one-patient-six-weeks.html", "kind": "tool" },
        { "ref": "question-bank-practice.html", "kind": "tool" }
          ]
        },
        {
          "n": 4,
          "title": "Family Systems & EE",
          "theme": "Family meetings · collateral",
          "landingRef": "week4.md",
          "focusCategories": ["relational"],
          "items": [
        { "ref": "exp_family.md", "kind": "read" },
        { "ref": "family_modalities.md", "kind": "read" },
        { "ref": "family_playbook.md", "kind": "read" },
        { "ref": "collateral_workflow.md", "kind": "read" },
        { "ref": "family-systems.html", "kind": "tool" },
        { "ref": "diagnostic-reasoning.html", "kind": "tool" },
        { "ref": "one-patient-six-weeks.html", "kind": "tool" },
        { "ref": "question-bank-practice.html", "kind": "tool" }
          ]
        },
        {
          "n": 5,
          "title": "Acute & Emergency",
          "theme": "Safety · agitation · withdrawal",
          "landingRef": "week5.md",
          "focusCategories": ["safety", "neurocog", "substance"],
          "items": [
        { "ref": "suicide.md", "kind": "read" },
        { "ref": "agitation.md", "kind": "read" },
        { "ref": "delirium.md", "kind": "read" },
        { "ref": "catatonia.md", "kind": "read" },
        { "ref": "withdrawal.html", "kind": "tool" },
        { "ref": "capacity.html", "kind": "tool" },
        { "ref": "one-patient-six-weeks.html", "kind": "tool" },
        { "ref": "question-bank-practice.html", "kind": "tool" }
          ]
        },
        {
          "n": 6,
          "title": "Integration & Exam",
          "theme": "Exam · OSCE · putting it together",
          "landingRef": "week6.md",
          "focusCategories": ["otherdx", "ethics"],
          "items": [
        { "ref": "shelf.md", "kind": "read" },
        { "ref": "osce.md", "kind": "read" },
        { "ref": "cases.md", "kind": "read" },
        { "ref": "landmark_trials.md", "kind": "read" },
        { "ref": "oral.html", "kind": "tool" },
        { "ref": "one-patient-six-weeks.html", "kind": "tool" },
        { "ref": "question-bank-practice.html", "kind": "tool" }
          ]
        }
      ]
    },
    "resident": {
      "id": "resident-four-week",
      "weeks": [
        {
          "n": 1,
          "title": "Foundations and safety",
          "theme": "Interview · MSE · acute risk · bedside syndromes",
          "focusCategories": ["safety", "neurocog", "substance"],
          "practice": {
            "skill": "Independently assess and manage an acute psychiatric emergency (suicide, agitation, catatonia, delirium) with appropriate escalation.",
            "feedback": "Can you review my risk formulation and tell me whether my escalation plan matches it?"
          },
          "items": [
            { "ref": "pg_interview.md", "kind": "read" },
            { "ref": "mse.html", "kind": "tool" },
            { "ref": "pg_suicide.md", "kind": "read" },
            { "ref": "agitation.md", "kind": "read" },
            { "ref": "violence.html", "kind": "tool" },
            { "ref": "delirium.md", "kind": "read" },
            { "ref": "withdrawal.html", "kind": "tool" },
            { "ref": "capacity.html", "kind": "tool" }
          ]
        },
        {
          "n": 2,
          "title": "Diagnosis and psychopharmacology",
          "theme": "Diagnostic reasoning · major syndromes · medication decisions",
          "focusCategories": ["mood", "psychosis", "pharm", "substance"],
          "practice": {
            "skill": "Build and defend a psychopharmacologic plan, including for a treatment-resistant patient.",
            "feedback": "Can you challenge my medication plan the way a consultant would, including what I do if it fails?"
          },
          "items": [
            { "ref": "diagnostic-reasoning.html", "kind": "tool" },
            { "ref": "t_mood.md", "kind": "read" },
            { "ref": "t_psychosis.md", "kind": "read" },
            { "ref": "t_sud.md", "kind": "read" },
            { "ref": "psychopharm_primer.md", "kind": "read" },
            { "ref": "adv_psychopharm.md", "kind": "read" },
            { "ref": "med_monitoring.md", "kind": "read" },
            { "ref": "interaction-cards.html", "kind": "tool" }
          ]
        },
        {
          "n": 3,
          "title": "Systems, med-legal, and disposition",
          "theme": "Consultation · collateral · family systems · defensible transitions",
          "focusCategories": ["ethics", "relational"],
          "practice": {
            "skill": "Determine and document decisional capacity, and navigate an involuntary hold appropriately.",
            "feedback": "Can you review how I documented capacity and legal status for this patient?"
          },
          "items": [
            { "ref": "systems_medlegal.md", "kind": "read" },
            { "ref": "cl_reference.md", "kind": "read" },
            { "ref": "exp_consult.md", "kind": "read" },
            { "ref": "collateral_workflow.md", "kind": "read" },
            { "ref": "family-systems.html", "kind": "tool" },
            { "ref": "rp-post-event-huddle.html", "kind": "tool" },
            { "ref": "exp_family.md", "kind": "read" },
            { "ref": "doc_oral.md", "kind": "read" }
          ]
        },
        {
          "n": 4,
          "title": "Integration, supervision, and scholarship",
          "theme": "Formulation · rounds · EPAs · evidence retrieval",
          "focusCategories": ["otherdx", "ethics", "relational"],
          "practice": {
            "skill": "Lead a treatment-team round and a family meeting. Give structured feedback to, and entrust appropriate tasks to, a medical student.",
            "feedback": "Can you watch me give the student feedback today and name one thing to change?"
          },
          "items": [
            { "ref": "case_formulation.md", "kind": "read" },
            { "ref": "oral.html", "kind": "tool" },
            { "ref": "supervision_teaching.md", "kind": "read" },
            { "ref": "evidence_inpatient.md", "kind": "read" },
            { "ref": "landmark_trials.md", "kind": "read" },
            { "ref": "canon_200.md", "kind": "read" },
            { "ref": "rp-canon-quiz.html", "kind": "tool" }
          ]
        }
      ]
    }
  },
  "libraryColumns": [
    {
      "name": "Interactive tools",
      "accent": "tool",
      "refs": [
        "mse.html", "interview-circle.html", "sp-interview.html",
        "communication-practice.html", "diagnostic-reasoning.html",
        "family-systems.html", "one-patient-six-weeks.html", "capacity.html",
        "oral.html", "violence.html", "screeners.html",
        "withdrawal.html", "decision-aids.html", "interaction-cards.html",
        "pharmacy.html", "reflection.html", "shelf-mode.html", "review.html",
        "question-bank-practice.html"
      ]
    },
    {
      "name": "Acute & safety",
      "accent": "safety",
      "refs": [
        "pg_suicide.md", "suicide.md", "cssrs.html", "agitation.md",
        "delirium.md", "catatonia.md", "bfcrs.html", "violence.md",
        "exp_consult.md", "toxidromes.md", "medical_workup.md",
        "protocol_library.md"
      ]
    },
    {
      "name": "Core topics",
      "accent": "topic",
      "refs": [
        "ddx.md", "t_mood.md", "t_psychosis.md", "t_anxiety.md",
        "t_personality.md", "t_sud.md", "t_geri.md", "t_perinatal.md",